{
  "id": "1234",
  "type": "Feature",
  "bbox": [
    172.91173669923782,
    1.3438851951615003,
    172.95469614953714,
    1.3690476620161975
  ],
  "geometry": {
    "type": "Polygon",
    "coordinates": [
      [
        [
          172.91173669923782,
          1.3438851951615003
        ],
        [
          172.95469614953714,
          1.3438851951615003
        ],
        [
          172.95469614953714,
          1.3690476620161975
        ],
        [
          172.91173669923782,
          1.3690476620161975
        ],
        [
          172.91173669923782,
          1.3438851951615003
        ]
      ]
    ]
  },
  "properties": {
    "determination_datetime": "2020-01-01T00:00:00Z"
  }
}
